{
 "schema_version": 1,
 "id": "M-0001",
 "status": "applied",
 "title": "strict inequality in the old text",
 "legacy": [
  {
   "version": "v0.2-de",
   "file": "legacy/old.tex",
   "line": 2,
   "file_sha256": "76fb82905a9f9fb8ee91024a430ecc1ac378472944d6c21946b1f21d5b219fa3",
   "old_text": "the count is n > 0",
   "new_text": "the count is n >= 0",
   "applied_file_sha256": "76fb82905a9f9fb8ee91024a430ecc1ac378472944d6c21946b1f21d5b219fa3",
   "applied_source_key": "fake-script",
   "applied_removed": true
  }
 ],
 "reason": "the empty heap has count zero",
 "evidence": {
  "independent_check": "fixture",
  "provenance_ids": [
   "P-0001"
  ]
 },
 "destination": "c98",
 "applied_date": "2026-10-22"
}
