{
 "schema_version": 1,
 "id": "M-0060",
 "status": "applied",
 "title": "vl04: 'we can write A as follows' where the display is C",
 "legacy": [
  {
   "version": "v0.2-de",
   "file": "latex/lectures/de/vl04.tex",
   "line": 199,
   "file_sha256": "e10cd13b0287b5114f3a30a7bfa9bdbb16a53aab755f8573bca795ae4a03aae9",
   "old_text": "können wir $A$ wie folgt darstellen",
   "new_text": "Mit der kanonischen Basis ... ist \\op{C}=\\ketbra{0}{1} + i\\,\\ketbra{1}{2} - \\ketbra{2}{0}",
   "applied_file_sha256": "f39e245d5da4da73fa9d394e81fc3530bd52ecbc097e65f6776f188e4a3df6e8",
   "applied_source_key": "tpc-script-v0.3.1",
   "applied_line": 108,
   "applied_text": "\\op{C} = \\ketbra{0}{1} + i\\,\\ketbra{1}{2} - \\ketbra{2}{0}"
  },
  {
   "version": "v0.2-en",
   "file": "latex/lectures/en/lec04.tex",
   "line": 199,
   "file_sha256": "9fd7efeb7a25a44f532e5a9be2d1278b3f669d04231772763fe0109c0f97ca8b",
   "old_text": "we can write $A$ as follows",
   "new_text": "With the canonical basis ... \\op{C}=\\ketbra{0}{1} + i\\,\\ketbra{1}{2} - \\ketbra{2}{0}",
   "applied_file_sha256": "1139a7442e1a981761156107a6cdb975bd117f2ed175974e1fa63559b48eb60b",
   "applied_source_key": "tpc-script-v0.3.1",
   "applied_line": 108,
   "applied_text": "\\op{C} = \\ketbra{0}{1} + i\\,\\ketbra{1}{2} - \\ketbra{2}{0}"
  }
 ],
 "reason": "The display after the sentence (vl04.tex:201) is the ket-bra form of C = |0><1| + i|1><2| - |2><0|, not of A; A is the hermitian matrix of the example. Checked with evidence/derivations/c03/check_c03.py (c03.cl.c-ketbra).",
 "evidence": {
  "independent_check": "evidence/derivations/c03/DERIVATION.md#c03.cl.c-ketbra",
  "provenance_ids": [],
  "derivation": "evidence/derivations/c03/DERIVATION.md#c03.cl.c-ketbra"
 },
 "destination": "c03.eq.c-ketbra",
 "notes": "Script v0.3, chapter 4 (docs/plan/script-v0.3/NOTES-ch4.md, 2026-10-29): applied in vl04.tex/lec04.tex line 107. Listed by lane A (NOTES-author.md section 3, line 199) and lane S.",
 "applied_date": "2026-10-29"
}
