{
 "schema_version": 1,
 "id": "M-0061",
 "status": "applied",
 "title": "vl04: 'for normal operators the defining equation passes to every eigenvalue' (normality is not needed)",
 "legacy": [
  {
   "version": "v0.2-de",
   "file": "latex/lectures/de/vl04.tex",
   "line": 207,
   "file_sha256": "e10cd13b0287b5114f3a30a7bfa9bdbb16a53aab755f8573bca795ae4a03aae9",
   "old_text": "für normale Operatoren überträgt sich die definierende Gleichung wörtlich auf jeden Eigenwert",
   "new_text": "Für jeden Eigenwert überträgt sich die definierende Gleichung der Klasse auf die Zahl $\\lambda$",
   "applied_file_sha256": "f39e245d5da4da73fa9d394e81fc3530bd52ecbc097e65f6776f188e4a3df6e8",
   "applied_source_key": "tpc-script-v0.3.1",
   "applied_line": 112,
   "applied_text": "Für jeden Eigenwert, den ein Operator hat, überträgt sich die definierende Gleichung seiner Klasse auf die Zahl"
  },
  {
   "version": "v0.2-en",
   "file": "latex/lectures/en/lec04.tex",
   "line": 207,
   "file_sha256": "9fd7efeb7a25a44f532e5a9be2d1278b3f669d04231772763fe0109c0f97ca8b",
   "old_text": "for normal operators the defining equation passes verbatim to every eigenvalue",
   "new_text": "For every eigenvalue the defining equation of the class carries over to the number $\\lambda$",
   "applied_file_sha256": "1139a7442e1a981761156107a6cdb975bd117f2ed175974e1fa63559b48eb60b",
   "applied_source_key": "tpc-script-v0.3.1",
   "applied_line": 112,
   "applied_text": "For every eigenvalue an operator has, the defining equation of its class carries over to the number"
  }
 ],
 "reason": "Each implication (A^dagger = A gives lambda* = lambda; A^dagger A = I gives |lambda| = 1; and so on) holds for every operator of the class and every eigenvalue; normality plays no role. Normality matters only for the converse (spectral theorem), and by itself it restricts the eigenvalues not at all (lambda times the identity is normal for every lambda). The new text says 'of the class' and adds that normality alone restricts nothing (line 120). The old line also uses dashes '---' in prose, dropped.",
 "evidence": {
  "independent_check": "evidence/derivations/c03/DERIVATION.md#c03.cl.orte",
  "provenance_ids": [],
  "derivation": "evidence/derivations/c03/DERIVATION.md#c03.cl.orte"
 },
 "destination": "c03.eq.orte",
 "notes": "Script v0.3, chapter 4 (docs/plan/script-v0.3/NOTES-ch4.md, 2026-10-29): applied in vl04.tex/lec04.tex lines 111 and 120. Listed by lane A (NOTES-author.md section 3, line 207; MINOR).",
 "applied_date": "2026-10-29"
}
