{
 "schema_version": 1,
 "id": "M-0056",
 "status": "applied",
 "title": "vl04: matrix elements 'by linearity of A' alone give the double expansion",
 "legacy": [
  {
   "version": "v0.2-de",
   "file": "latex/lectures/de/vl04.tex",
   "line": 85,
   "file_sha256": "e10cd13b0287b5114f3a30a7bfa9bdbb16a53aab755f8573bca795ae4a03aae9",
   "old_text": "Wegen der Linearität von A ist dann",
   "new_text": "Wegen der Linearität von A und der Entwicklungsformel ist dann",
   "applied_file_sha256": "f39e245d5da4da73fa9d394e81fc3530bd52ecbc097e65f6776f188e4a3df6e8",
   "applied_source_key": "tpc-script-v0.3.1",
   "applied_line": 65,
   "applied_text": "wenn man die Entwicklung nach der Basis zweimal einsetzt"
  },
  {
   "version": "v0.2-en",
   "file": "latex/lectures/en/lec04.tex",
   "line": 85,
   "file_sha256": "9fd7efeb7a25a44f532e5a9be2d1278b3f669d04231772763fe0109c0f97ca8b",
   "old_text": "Because of the linearity of A we then have",
   "new_text": "Because of the linearity of A and the expansion formula we then have",
   "applied_file_sha256": "1139a7442e1a981761156107a6cdb975bd117f2ed175974e1fa63559b48eb60b",
   "applied_source_key": "tpc-script-v0.3.1",
   "applied_line": 65,
   "applied_text": "by inserting the expansion in the basis twice"
  }
 ],
 "reason": "The formula A|Psi> = sum_{x,y} |phi_x> [A]_xy <phi_y|Psi> follows from the expansion of Psi in the basis, linearity of A and the expansion of A|phi_y> in the basis; linearity alone does not give it (vl04.tex:89 itself says the expansion is inserted twice). The new text says so where the formula is introduced.",
 "evidence": {
  "independent_check": "evidence/derivations/c03/DERIVATION.md#c03.cl.wirkung",
  "provenance_ids": [],
  "derivation": "evidence/derivations/c03/DERIVATION.md#c03.cl.wirkung"
 },
 "destination": "c03.eq.wirkung",
 "notes": "Script v0.3, chapter 4 (docs/plan/script-v0.3/NOTES-ch4.md, 2026-10-29): applied in vl04.tex/lec04.tex line 59.",
 "applied_date": "2026-10-29"
}
