{
 "schema_version": 1,
 "id": "M-0021",
 "status": "applied",
 "title": "vl03: three German slips in the opening (Quantemechanik, missing subject, 'das Heisst')",
 "legacy": [
  {
   "version": "v0.2-de",
   "file": "latex/lectures/de/vl03.tex",
   "line": 5,
   "file_sha256": "5ade0d2df8358f22497f3e207710b2c0efb7c74ea9da31ae420bcb23d469837e",
   "old_text": "In der Quantemechanik",
   "new_text": "In der Quantenmechanik wird die folgende Schreibweise universell verwendet",
   "applied_file_sha256": "943dd6deb47f3ddcc90821aea7697aa75400cfadc7cbb967fd55259e16630c34",
   "applied_source_key": "tpc-script-v0.3.1",
   "applied_line": 7,
   "applied_text": "In der Quantenmechanik wird die folgende Schreibweise universell verwendet"
  },
  {
   "version": "v0.2-de",
   "file": "latex/lectures/de/vl03.tex",
   "line": 9,
   "file_sha256": "5ade0d2df8358f22497f3e207710b2c0efb7c74ea9da31ae420bcb23d469837e",
   "old_text": "Warum diese ungewöhnliche Notation eingeführt haben wird demnächst klar.",
   "new_text": "Warum wir diese ungewöhnliche Notation eingeführt haben, wird bald klar.",
   "applied_file_sha256": "943dd6deb47f3ddcc90821aea7697aa75400cfadc7cbb967fd55259e16630c34",
   "applied_source_key": "tpc-script-v0.3.1",
   "applied_line": 7,
   "applied_text": "warum wir sie einführen, wird bald klar"
  },
  {
   "version": "v0.2-de",
   "file": "latex/lectures/de/vl03.tex",
   "line": 45,
   "file_sha256": "5ade0d2df8358f22497f3e207710b2c0efb7c74ea9da31ae420bcb23d469837e",
   "old_text": "das Heisst",
   "new_text": "Es macht übrigens keinen Unterschied, ob wir $\\ket{v + w}$ oder $\\ket{v} + \\ket{w}$ aufschreiben",
   "applied_file_sha256": "943dd6deb47f3ddcc90821aea7697aa75400cfadc7cbb967fd55259e16630c34",
   "applied_source_key": "tpc-script-v0.3.1",
   "applied_removed": true
  },
  {
   "version": "v0.1",
   "file": "archive/skript-2022/Vorlesungen3.tex",
   "line": 5,
   "file_sha256": "389a16293491295d301d6749de11bedbb17c8c712e1f66ca9da9dd4684b45533",
   "old_text": "In der Quantemechanik",
   "new_text": "In der Quantenmechanik wird die folgende Schreibweise universell verwendet"
  },
  {
   "version": "v0.1",
   "file": "archive/skript-2022/Vorlesungen3.tex",
   "line": 9,
   "file_sha256": "389a16293491295d301d6749de11bedbb17c8c712e1f66ca9da9dd4684b45533",
   "old_text": "Warum diese ungewöhnliche Notation eingeführt haben wird demnächst klar.",
   "new_text": "Warum wir diese ungewöhnliche Notation eingeführt haben, wird bald klar."
  },
  {
   "version": "v0.1",
   "file": "archive/skript-2022/Vorlesungen3.tex",
   "line": 43,
   "file_sha256": "389a16293491295d301d6749de11bedbb17c8c712e1f66ca9da9dd4684b45533",
   "old_text": "das Heisst",
   "new_text": "Es macht übrigens keinen Unterschied, ob wir $\\ket{v + w}$ oder $\\ket{v} + \\ket{w}$ aufschreiben"
  }
 ],
 "reason": "Wording only: 'Quantemechanik' (typo for Quantenmechanik), 'Warum diese ungewöhnliche Notation eingeführt haben wird demnächst klar' (the subject 'wir' and the comma are missing), 'das Heisst' (capital H after a lower-case 'das', and 'heißt'). The English edition (lec03.tex:5, 9, 45) does not have these slips. The new chapter writes the corrected German.",
 "evidence": {
  "independent_check": "read in the script sources at the stated lines",
  "provenance_ids": []
 },
 "destination": "c03.s4",
 "applied_date": "2026-10-29",
 "notes": "Script v0.3, chapter 3 (docs/plan/script-v0.3/NOTES-ch3.md, repair wave 2026-10-29): applied in vl03.tex/lec03.tex at the recorded applied_line; the English never had the slips, so only the German loci are applied."
}
