{
 "schema_version": 1,
 "id": "M-0022",
 "status": "recorded",
 "title": "vl03: the closing quotation mark and the trailing words of the basis display sit inside \\emph{}",
 "legacy": [
  {
   "version": "v0.2-de",
   "file": "latex/lectures/de/vl03.tex",
   "line": 188,
   "file_sha256": "5ade0d2df8358f22497f3e207710b2c0efb7c74ea9da31ae420bcb23d469837e",
   "old_text": "\\emph{orthonormal``) und}}",
   "new_text": "„$\\{\\ket{\\phi_j}\\}$ ist \\emph{orthonormal}“ (D84, D85)"
  },
  {
   "version": "v0.2-de",
   "file": "latex/lectures/de/vl03.tex",
   "line": 189,
   "file_sha256": "5ade0d2df8358f22497f3e207710b2c0efb7c74ea9da31ae420bcb23d469837e",
   "old_text": "\\emph{vollständig``).}}",
   "new_text": "„$\\{\\ket{\\phi_j}\\}$ ist \\emph{vollständig}“ (D85)"
  },
  {
   "version": "v0.1",
   "file": "archive/skript-2022/Vorlesungen3.tex",
   "line": 171,
   "file_sha256": "389a16293491295d301d6749de11bedbb17c8c712e1f66ca9da9dd4684b45533",
   "old_text": "\\emph{orthonormal``) und}}",
   "new_text": "„$\\{\\ket{\\phi_j}\\}$ ist \\emph{orthonormal}“ (D84, D85)"
  },
  {
   "version": "v0.1",
   "file": "archive/skript-2022/Vorlesungen3.tex",
   "line": 172,
   "file_sha256": "389a16293491295d301d6749de11bedbb17c8c712e1f66ca9da9dd4684b45533",
   "old_text": "\\emph{vollständig``).}}",
   "new_text": "„$\\{\\ket{\\phi_j}\\}$ ist \\emph{vollständig}“ (D85)"
  }
 ],
 "reason": "In both lines the \\emph{} group closes after the quotation mark and the following words ('``) und', '``).'), so the closing quote, the parenthesis and 'und' typeset in italics. The English edition closes the group correctly (lec03.tex:188-189). The new chapter takes orthonormality and completeness from the registry definitions D84 and D85, where only the defined word is emphasised.",
 "evidence": {
  "independent_check": "read in the script sources at the stated lines",
  "provenance_ids": []
 },
 "destination": "c03.s7",
 "notes": "Listed in HANDOFF.md, section 'Three v0.1 wording slips' (it is in vl03.tex and in the archive, not only in one of them)."
}
