{
 "schema_version": 1,
 "id": "M-0063",
 "status": "applied",
 "title": "vl04: 'isometric operators are automatically normal only in the finite-dimensional case' is imprecise",
 "legacy": [
  {
   "version": "v0.2-de",
   "file": "latex/lectures/de/vl04.tex",
   "line": 69,
   "file_sha256": "e10cd13b0287b5114f3a30a7bfa9bdbb16a53aab755f8573bca795ae4a03aae9",
   "old_text": "isometrische sind erst im endlich-dimensionalen Fall automatisch normal",
   "new_text": "in endlicher Dimension ist jede Isometrie unitär ... Isometrien sind normal",
   "applied_file_sha256": "f39e245d5da4da73fa9d394e81fc3530bd52ecbc097e65f6776f188e4a3df6e8",
   "applied_source_key": "tpc-script-v0.3.1",
   "applied_line": 57,
   "applied_text": "In endlicher Dimension ist jede Isometrie unitär"
  },
  {
   "version": "v0.2-en",
   "file": "latex/lectures/en/lec04.tex",
   "line": 69,
   "file_sha256": "9fd7efeb7a25a44f532e5a9be2d1278b3f669d04231772763fe0109c0f97ca8b",
   "old_text": "isometric ones are automatically normal only in the finite-dimensional case",
   "new_text": "in finite dimension every isometry is unitary ... isometries are normal",
   "applied_file_sha256": "1139a7442e1a981761156107a6cdb975bd117f2ed175974e1fa63559b48eb60b",
   "applied_source_key": "tpc-script-v0.3.1",
   "applied_line": 57,
   "applied_text": "In finite dimension every isometry is unitary"
  }
 ],
 "reason": "The reason is not stated: in finite dimension an isometry V (V^dagger V = I) is injective, hence bijective, hence unitary, hence normal. In infinite dimension an isometry need not be normal (the right shift on l^2 is an isometry with S S^dagger != S^dagger S). The new text gives the reason (isometry = unitary in finite dimension, line 56) and the lecture's finite-dimension hypothesis (line 17). The old line also uses a dash '---' in prose.",
 "evidence": {
  "independent_check": "content/c03-hilbertraum/de.tex c03.prop.isometrie and c03.ex.shift (c03.cl.isometrie, c03.cl.shift)",
  "provenance_ids": []
 },
 "destination": "c03.prop.isometrie",
 "notes": "Script v0.3, chapter 4 (docs/plan/script-v0.3/NOTES-ch4.md, 2026-10-29): applied in vl04.tex/lec04.tex line 56. Together with the M-0005 locus (line 50: the infinite-dimensional case goes to the web course).",
 "applied_date": "2026-10-29"
}
