{
 "schema_version": 1,
 "id": "M-0005",
 "status": "applied",
 "title": "vl04: 'hermitesch (Synonym: selbstadjungiert)' omits domain and scope",
 "legacy": [
  {
   "version": "v0.2-de",
   "file": "latex/lectures/de/vl04.tex",
   "line": 70,
   "file_sha256": "e10cd13b0287b5114f3a30a7bfa9bdbb16a53aab755f8573bca795ae4a03aae9",
   "old_text": "Die hermiteschen Operatoren (Synonym: selbstadjugierte Operatoren) entsprechen den \\emph{Observablen} der QM, da",
   "new_text": null,
   "gap_tjo": "The corrected wording (scope: finite dimension or bounded operators; domains otherwise) is prose and is TJO's or the chapter author's to write; it is not proposed here.",
   "applied_file_sha256": "f39e245d5da4da73fa9d394e81fc3530bd52ecbc097e65f6776f188e4a3df6e8",
   "applied_source_key": "tpc-script-v0.3.1",
   "applied_line": 51,
   "applied_text": "Hermitesche Operatoren heißen oft auch selbstadjungiert; in endlicher Dimension ist das dasselbe"
  },
  {
   "version": "v0.2-en",
   "file": "latex/lectures/en/lec04.tex",
   "line": 70,
   "file_sha256": "9fd7efeb7a25a44f532e5a9be2d1278b3f669d04231772763fe0109c0f97ca8b",
   "old_text": "The Hermitian operators (synonym: self-adjoint operators) correspond to the \\emph{observables} of QM, since",
   "new_text": null,
   "gap_tjo": "The corrected wording (scope: finite dimension or bounded operators; domains otherwise) is prose and is TJO's or the chapter author's to write; it is not proposed here.",
   "applied_file_sha256": "1139a7442e1a981761156107a6cdb975bd117f2ed175974e1fa63559b48eb60b",
   "applied_source_key": "tpc-script-v0.3.1",
   "applied_line": 51,
   "applied_text": "Hermitian operators are often also called self-adjoint; in finite dimension this is the same thing"
  },
  {
   "version": "v0.1",
   "file": "archive/skript-2022/Vorlesungen4.tex",
   "line": 57,
   "file_sha256": "d81d48818d677ba6f61eb876c8f0461440dd7aa3baf4aa3f5bb7c04ef62cacb7",
   "old_text": "Die hermiteschen Operatoren (Synonym: selbstadjugierte Operatoren) entsprechen den \\emph{Observablen} der QM, da",
   "new_text": null,
   "gap_tjo": "The corrected wording (scope: finite dimension or bounded operators; domains otherwise) is prose and is TJO's or the chapter author's to write; it is not proposed here."
  }
 ],
 "reason": "A scope omission, not a false equation: vl04.tex:62 defines 'hermitesch' by A^dagger = A, which is the self-adjointness condition once domains are included. What is missing is the domain and the scope (matrices and bounded operators), and the script later relies on mere symmetry. Example from the review: -i d/dx on H_0^1(0,1) is symmetric but not self-adjoint. The line also misspells 'selbstadjungierte' as 'selbstadjugierte'.",
 "evidence": {
  "independent_check": "docs/plan/research/review/REVIEW.md:61 (section B, row 'vl04 Hermitian/self-adjoint synonym': REFUTED as an unconditional defect; the real defect is omitted domain/scope) and REVIEW.md section G; HANDOFF.md says the same",
  "provenance_ids": []
 },
 "destination": "c03",
 "applied_date": "2026-10-29",
 "notes": "Script v0.3, chapter 4 (docs/plan/script-v0.3/NOTES-ch4.md, 2026-10-29): applied in vl04.tex/lec04.tex line 50: Hermitian = self-adjoint in finite dimension, different notions in infinitely many dimensions (web course); the typo 'selbstadjugierte' is gone. The wording is lane S's, condensed from the course (c03.s10, D18, c03.v5; Reed-Simon I pp. 255 f., P-0322, P-0324), so new_text stays null."
}
