{
 "schema_version": 1,
 "id": "M-0052",
 "status": "applied",
 "title": "vl04: 'Die Vektoren des Hilbertraums beschreiben die Zustaende' contradicts the course (states are density operators)",
 "legacy": [
  {
   "version": "v0.2-de",
   "file": "latex/lectures/de/vl04.tex",
   "line": 5,
   "file_sha256": "e10cd13b0287b5114f3a30a7bfa9bdbb16a53aab755f8573bca795ae4a03aae9",
   "old_text": "Die Vektoren des Hilbertraums beschreiben die Zustände eines Systems, die Operatoren seine Observablen",
   "new_text": "Das zweite Standbein der Theorie sind die Operatoren: Mit ihnen beschreibt die Quantenmechanik Zustände, Messungen und Dynamik.",
   "applied_file_sha256": "f39e245d5da4da73fa9d394e81fc3530bd52ecbc097e65f6776f188e4a3df6e8",
   "applied_source_key": "tpc-script-v0.3.1",
   "applied_line": 7,
   "applied_text": "Mit ihnen beschreibt die Quantenmechanik Zustände, Messungen und Dynamik"
  },
  {
   "version": "v0.2-en",
   "file": "latex/lectures/en/lec04.tex",
   "line": 5,
   "file_sha256": "9fd7efeb7a25a44f532e5a9be2d1278b3f669d04231772763fe0109c0f97ca8b",
   "old_text": "The vectors of the Hilbert space describe the states of a system, the operators its observables",
   "new_text": "The second pillar of the theory is the operators: with them quantum mechanics describes states, measurements and dynamics.",
   "applied_file_sha256": "1139a7442e1a981761156107a6cdb975bd117f2ed175974e1fa63559b48eb60b",
   "applied_source_key": "tpc-script-v0.3.1",
   "applied_line": 7,
   "applied_text": "with them quantum mechanics describes states, measurements and dynamics"
  }
 ],
 "reason": "vl04.tex:5 says the vectors of the Hilbert space describe the states of a system. In the course the states are the density operators (positive, trace one, D22); a vector describes a pure state only through its projector (c03.s1 says so). Hazard H3.2 of the curriculum report. The same sentence stood in vl03:254, the opening of the subsection that moved to vl04. The new text attributes states, measurements and dynamics to the operators and does not call a vector a state.",
 "evidence": {
  "independent_check": "docs/plan/research/curriculum/REPORT.md (H3.2); docs/plan/lec34/BRIEF.md (Correctness hazards); content/c03-hilbertraum/de.tex c03.s1 and c03.s8",
  "provenance_ids": []
 },
 "destination": "c03.s8",
 "notes": "Script v0.3, chapter 4 (docs/plan/script-v0.3/NOTES-ch4.md, 2026-10-29): applied in vl04.tex/lec04.tex line 7 (and lec04 line 7). Listed by lane A (docs/plan/lec34/NOTES-author.md section 3, line 5) and lane S.",
 "applied_date": "2026-10-29"
}
